date|title|speech
18/09/2020 17h16|Discurso do Presidente da República, Jair Bolsonaro, durante a Cerimônia  do Ato de entrega de Títulos de Propriedade Rural- Sorriso/MT|"Sorriso/MT, 18 de setembro de 2020

Boa tarde! É uma satisfação estar aqui no Centro-Oeste, neste estado que representa muito para o futuro do nosso Brasil.
Por vezes, o serviço que nós prestamos, para nós, é pouco, mas para quem o recebe, ele é muito.
Essas pessoas que receberam agora, simbolicamente, o título de propriedade rural, obviamente, passam a ser mais do que reconhecidos, passam a serem donos de um pedaço de terra. Onde eles possam dizer para si e para os seus, que  isso  é meu.
É a mesma coisa quando aquele homem da cidade deixa o aluguel ou deixa de morar na casa da sogra e vai ter a sua casa própria.  Realmente, a satisfação é enorme e essa é a nossa obrigação.
Desde o princípio, eu sempre disse: o nosso trabalho é fazer o bem da população, é trazer segurança para o nosso povo, é dar esperança concreta que nós podemos mudar o destino do Brasil.
Esse estado, um dos maiores de extensão do Brasil, a sua vocação é o agronegócio e, cada dia, cada mês, cada ano, nós estamos tendo prova disso. Vocês não pararam durante a pandemia. Vocês não entraram naquela conversinha mole de ficar em casa e a economia a gente vê depois. Fique em casa que a economia a gente vê depois, isso é para os fracos.
O vírus, eu sempre disse, era uma realidade e tínhamos que enfrentá-lo nada de se acovardar perante aquilo que nós não podemos fugir dele, esta região, esse estado agiu dessa maneira.
O agronegócio, em grande parte, evitou que o Brasil entrasse num colapso econômico e, mais do que isso, nos deu a segurança alimentar, não só a 210  milhões de brasileiros, bem como mais de um bilhão de outras pessoas que vivem ao redor deste enorme mundo.
Vocês estão de parabéns, vocês são o nosso orgulho! Vocês venceram este obstáculo; o Brasil confia e precisa muito mais de vocês.
E eu tenho certeza, cada vez mais, com pessoas competentes na política, com pessoa bem escolhida por vocês, nós mudaremos o destino do nosso Brasil.
Hoje, nós vivemos numa política bastante saudável com o parlamento brasileiro, bem como com a maioria dos governadores como o nosso governador aqui de Mato Grosso.
Vivemos aquilo que através dessa união, dessa harmonia, vem trazer não mais que solução, vem trazer  garantia que vocês realmente poderão ter dias melhores.
Temos aqui três ministros me acompanhando, o Tarcísio, que é do conhecimento já de todos vocês; é aquele homem que concluiu a 163, obra que começou lá atrás, ainda no governo Geisel, e que muito ajudou aqui para escoar o que vocês produzem.
Temos também um exemplo, uma pessoa que nos momentos difíceis  sempre nos bem aconselha em Brasília que é o general Augusto Heleno e nessa viagem já serviu, entre outras coisas, para saber da influência transgênera nesta região.
E também um amigo meu, desde 1973, o general Ramos, nosso ministro palaciano também. E, graças à forma como eu fui eleito, em especial, tive a liberdade de escolher o ministério que eu achava que melhor poderia servir a nossa Pátria. Estamos dando conta desse recado, mas o apoio popular, o apoio de vocês, é indispensável em qualquer situação.
Não tem nenhum poder melhor do que o outro, nem um poder superior a outro, somos três poderes harmônicos e independentes e assim devemos continuar sendo; agora, o apoio de vocês é que realmente faz a diferença para que nós possamos  conviver em paz, em liberdade e harmonia.
A todos vocês de Mato Grosso, meu muito obrigado pelo apoio que me deram por ocasião das eleições.
Quem decidiu as eleições, num primeiro momento, foi vocês mas no momento mais crucial foi Deus que decidiu quem era aquela pessoa para comandar o destino dessa nação.
Muito obrigado a todos vocês.
Brasil acima de tudo, Mato Grosso acima de todos e Deus abençoe o nosso País.

 
 
 
 
"
