date|title|speech
 27 MAY 2018|Presidente Piñera celebra el Día del Patrimonio|"

S.E. el Presidente de la República, Sebastián Piñera, celebra el día del Patrimonio Nacional junto a la Ministra de la Cultura, Las Artes y el Patrimonio, Alejandra Pérez, y el Subsecretario de Patrimonio Cultural, Emilio de la Cerda. Junto a un grupo de adultos y niños realizarán un tour por las dependencias del Palacio de La Moneda.

Hoy estamos celebrando el “Día del Patrimonio y de la Cultura” en nuestro país. Hemos decidido que sea no solamente el día domingo, como era tradicionalmente, sino que dos días, el sábado y el domingo, y estamos muy contentos, porque miles y miles de compatriotas han recorrido, han visitado, han  apreciado, han podido conocer mejor  lo que es nuestra arquitectura, nuestra historia, nuestras tradiciones y nuestra cultura.
 
Todos los edificios con valor histórico o patrimonial, han estado abiertos, para que la gente los conozca, porque la cultura y el patrimonio le pertenecen a la gente.
 
Así que me alegro mucho que en estos dos días, sábado y domingo, en que hemos celebrado el “Día del Patrimonio”, miles y miles de chilenos -como los que están hoy día aquí-, con mucho entusiasmo y con mucha curiosidad, han podido conocer los monumentos que son parte de nuestra historia, que son parte de nuestra identidad, que son parte de nuestra cultura.
 

"
